[
  {
    "id": "gptbot",
    "name": "GPTBot",
    "user_agent": "Mozilla/5.0 AppleWebKit/537.36 (KHTML, like Gecko); compatible with GPTBot/1.0; +https://openai.com/gptbot",
    "purpose": "training",
    "vendor": "OpenAI",
    "docs_url": "https://platform.openai.com/docs/gptbot",
    "status": "active",
    "respects_robots_txt": true,
    "robots_txt_entry": "GPTBot",
    "allow_recipe": "User-agent: GPTBot\nDisallow:",
    "disallow_recipe": "User-agent: GPTBot\nDisallow: /",
    "added": "2026-07-10",
    "notes": "OpenAI's web crawler for training GPT models. Respects robots.txt and includes a rate limiting mechanism."
  },
  {
    "id": "chatgpt-user",
    "name": "ChatGPT-User",
    "user_agent": "Mozilla/5.0 AppleWebKit/537.36 (KHTML, like Gecko); compatible with ChatGPT-User/1.0; +https://openai.com/chatgpt-user",
    "purpose": "agent",
    "vendor": "OpenAI",
    "docs_url": "https://platform.openai.com/docs/plugins",
    "status": "active",
    "respects_robots_txt": true,
    "robots_txt_entry": "ChatGPT-User",
    "allow_recipe": "User-agent: ChatGPT-User\nDisallow:",
    "disallow_recipe": "User-agent: ChatGPT-User\nDisallow: /",
    "added": "2026-07-10",
    "notes": "Used when ChatGPT users browse the web via the Browse feature. Separate from GPTBot."
  },
  {
    "id": "claudebot",
    "name": "ClaudeBot",
    "user_agent": "Mozilla/5.0 AppleWebKit/537.36 (KHTML, like Gecko); compatible with ClaudeBot/1.0; +https://docs.anthropic.com/en/docs/claudebot",
    "purpose": "training",
    "vendor": "Anthropic",
    "docs_url": "https://docs.anthropic.com/en/docs/claudebot",
    "status": "active",
    "respects_robots_txt": true,
    "robots_txt_entry": "ClaudeBot",
    "allow_recipe": "User-agent: ClaudeBot\nDisallow:",
    "disallow_recipe": "User-agent: ClaudeBot\nDisallow: /",
    "added": "2026-07-10",
    "notes": "Anthropic's web crawler for training Claude models. Also used by Claude Code for web research."
  },
  {
    "id": "claude-web",
    "name": "Claude-Web",
    "user_agent": "Claude-Web/1.0",
    "purpose": "agent",
    "vendor": "Anthropic",
    "docs_url": "https://docs.anthropic.com/en/docs/claude-web",
    "status": "active",
    "respects_robots_txt": true,
    "robots_txt_entry": "Claude-Web",
    "allow_recipe": "User-agent: Claude-Web\nDisallow:",
    "disallow_recipe": "User-agent: Claude-Web\nDisallow: /",
    "added": "2026-07-10",
    "notes": "Used when Claude users browse the web. Respects robots.txt separately from ClaudeBot."
  },
  {
    "id": "perplexitybot",
    "name": "PerplexityBot",
    "user_agent": "Mozilla/5.0 AppleWebKit/537.36 (KHTML, like Gecko); compatible with PerplexityBot/1.0; +https://docs.perplexity.ai/docs/perplexitybot",
    "purpose": "search",
    "vendor": "Perplexity AI",
    "docs_url": "https://docs.perplexity.ai/docs/perplexitybot",
    "status": "active",
    "respects_robots_txt": true,
    "robots_txt_entry": "PerplexityBot",
    "allow_recipe": "User-agent: PerplexityBot\nDisallow:",
    "disallow_recipe": "User-agent: PerplexityBot\nDisallow: /",
    "added": "2026-07-10",
    "notes": "Perplexity AI's web crawler for search indexing and answer generation."
  },
  {
    "id": "google-extended",
    "name": "Google-Extended",
    "user_agent": "Google-Extended",
    "purpose": "training",
    "vendor": "Google",
    "docs_url": "https://developers.google.com/search/docs/crawling-indexing/overview-google-crawlers",
    "status": "active",
    "respects_robots_txt": true,
    "robots_txt_entry": "Google-Extended",
    "allow_recipe": "User-agent: Google-Extended\nDisallow:",
    "disallow_recipe": "User-agent: Google-Extended\nDisallow: /",
    "added": "2026-07-10",
    "notes": "Google's crawler for AI model training and Gemini-powered features. Separate from Googlebot."
  },
  {
    "id": "bytespider",
    "name": "Bytespider",
    "user_agent": "Mozilla/5.0 (compatible; Bytespider; +https://bytespider.bytedance.com/)",
    "purpose": "training",
    "vendor": "ByteDance",
    "docs_url": "https://bytespider.bytedance.com",
    "status": "active",
    "respects_robots_txt": true,
    "robots_txt_entry": "Bytespider",
    "allow_recipe": "User-agent: Bytespider\nDisallow:",
    "disallow_recipe": "User-agent: Bytespider\nDisallow: /",
    "added": "2026-07-10",
    "notes": "ByteDance's AI training crawler. Known for aggressive crawling patterns."
  },
  {
    "id": "amazonbot",
    "name": "Amazonbot",
    "user_agent": "Mozilla/5.0 (compatible; Amazonbot/1.0; +https://developer.amazon.com/support/amazonbot)",
    "purpose": "search",
    "vendor": "Amazon",
    "docs_url": "https://developer.amazon.com/support/amazonbot",
    "status": "active",
    "respects_robots_txt": true,
    "robots_txt_entry": "Amazonbot",
    "allow_recipe": "User-agent: Amazonbot\nDisallow:",
    "disallow_recipe": "User-agent: Amazonbot\nDisallow: /",
    "added": "2026-07-10",
    "notes": "Amazon's web crawler for product and content indexing."
  },
  {
    "id": "cohere-ai",
    "name": "CohereAI",
    "user_agent": "CohereAI/1.0",
    "purpose": "training",
    "vendor": "Cohere",
    "docs_url": "https://docs.cohere.com",
    "status": "active",
    "respects_robots_txt": true,
    "robots_txt_entry": "CohereAI",
    "allow_recipe": "User-agent: CohereAI\nDisallow:",
    "disallow_recipe": "User-agent: CohereAI\nDisallow: /",
    "added": "2026-07-10",
    "notes": "Cohere's web crawler for training enterprise AI models."
  },
  {
    "id": "meta-externalagent",
    "name": "Meta-ExternalAgent",
    "user_agent": "Meta-ExternalAgent/1.0",
    "purpose": "agent",
    "vendor": "Meta",
    "docs_url": "https://developers.facebook.com/docs/sharing/webmasters/crawler",
    "status": "active",
    "respects_robots_txt": true,
    "robots_txt_entry": "Meta-ExternalAgent",
    "allow_recipe": "User-agent: Meta-ExternalAgent\nDisallow:",
    "disallow_recipe": "User-agent: Meta-ExternalAgent\nDisallow: /",
    "added": "2026-07-10",
    "notes": "Meta's crawler for AI assistant features across Facebook, Instagram, WhatsApp."
  },
  {
    "id": "meta-externalfetcher",
    "name": "Meta-ExternalFetcher",
    "user_agent": "Meta-ExternalFetcher/1.0",
    "purpose": "research",
    "vendor": "Meta",
    "docs_url": "https://developers.facebook.com/docs/sharing/webmasters/crawler",
    "status": "active",
    "respects_robots_txt": true,
    "robots_txt_entry": "Meta-ExternalFetcher",
    "allow_recipe": "User-agent: Meta-ExternalFetcher\nDisallow:",
    "disallow_recipe": "User-agent: Meta-ExternalFetcher\nDisallow: /",
    "added": "2026-07-10",
    "notes": "Meta's research crawler for AI training data collection."
  },
  {
    "id": "applebot",
    "name": "Applebot",
    "user_agent": "Mozilla/5.0 (compatible; Applebot/1.0; +https://support.apple.com/applebot)",
    "purpose": "search",
    "vendor": "Apple",
    "docs_url": "https://support.apple.com/applebot",
    "status": "active",
    "respects_robots_txt": true,
    "robots_txt_entry": "Applebot",
    "allow_recipe": "User-agent: Applebot\nDisallow:",
    "disallow_recipe": "User-agent: Applebot\nDisallow: /",
    "added": "2026-07-10",
    "notes": "Apple's web crawler used for Siri, Spotlight, and Apple Intelligence features."
  },
  {
    "id": "applebot-extended",
    "name": "Applebot-Extended",
    "user_agent": "Applebot-Extended/1.0",
    "purpose": "training",
    "vendor": "Apple",
    "docs_url": "https://support.apple.com/applebot",
    "status": "active",
    "respects_robots_txt": true,
    "robots_txt_entry": "Applebot-Extended",
    "allow_recipe": "User-agent: Applebot-Extended\nDisallow:",
    "disallow_recipe": "User-agent: Applebot-Extended\nDisallow: /",
    "added": "2026-07-10",
    "notes": "Apple's crawler for AI model training. Separate from Applebot."
  },
  {
    "id": "anthropic-ai",
    "name": "anthropic-ai",
    "user_agent": "anthropic-ai/1.0",
    "purpose": "training",
    "vendor": "Anthropic",
    "docs_url": "https://docs.anthropic.com/en/docs/anthropic-ai",
    "status": "active",
    "respects_robots_txt": true,
    "robots_txt_entry": "anthropic-ai",
    "allow_recipe": "User-agent: anthropic-ai\nDisallow:",
    "disallow_recipe": "User-agent: anthropic-ai\nDisallow: /",
    "added": "2026-07-10",
    "notes": "Additional Anthropic crawler for AI training data collection."
  },
  {
    "id": "diffbot",
    "name": "Diffbot",
    "user_agent": "Mozilla/5.0 (compatible; Diffbot/1.0; +https://www.diffbot.com)",
    "purpose": "research",
    "vendor": "Diffbot",
    "docs_url": "https://www.diffbot.com",
    "status": "active",
    "respects_robots_txt": true,
    "robots_txt_entry": "Diffbot",
    "allow_recipe": "User-agent: Diffbot\nDisallow:",
    "disallow_recipe": "User-agent: Diffbot\nDisallow: /",
    "added": "2026-07-10",
    "notes": "AI-powered web extraction and knowledge graph crawler."
  },
  {
    "id": "commoncrawl",
    "name": "CCBot",
    "user_agent": "CCBot/1.0 (+https://commoncrawl.org/ccbot)",
    "purpose": "research",
    "vendor": "Common Crawl",
    "docs_url": "https://commoncrawl.org/ccbot",
    "status": "active",
    "respects_robots_txt": true,
    "robots_txt_entry": "CCBot",
    "allow_recipe": "User-agent: CCBot\nDisallow:",
    "disallow_recipe": "User-agent: CCBot\nDisallow: /",
    "added": "2026-07-10",
    "notes": "Common Crawl's open web crawler. A primary source of training data for many LLMs."
  },
  {
    "id": "omgili",
    "name": "Omgili",
    "user_agent": "Omgili/1.0 (+https://www.omgili.com)",
    "purpose": "research",
    "vendor": "Omgili",
    "docs_url": "https://www.omgili.com",
    "status": "active",
    "respects_robots_txt": true,
    "robots_txt_entry": "Omgili",
    "allow_recipe": "User-agent: Omgili\nDisallow:",
    "disallow_recipe": "User-agent: Omgili\nDisallow: /",
    "added": "2026-07-10",
    "notes": "Web crawler focused on forum and discussion content for AI training."
  },
  {